<?xml version="1.0" encoding="UTF-8" standalone="no" ?>
<!--
   New Perspectives on HTML, CSS, and XML
   Tutorial 14
   Case Problem 4

   South Racing teams list
   Author: Rajat Hatwar
   Date:   12/02/2016

   Filename:         teams.xml
   Supporting Files: teams.css
-->

<teams xmlns:xsi="http://www.w3.org/2001/XMLSchema-instance"
      xsi:noNamespaceSchemaLocation="teams.xsd">
   <team tid="t205">
      <title>Rodas Motorsports</title>
      <description>#1 Team in racing</description>
      <series>Indy</series>
   </team>

   <team tid="t105">
      <title>SAM Racing</title>
      <description>Top 10 over last 5 years</description>
      <series>Nascar</series>
   </team>

</teams>